dataSetName,dataSetDesc,dataURL,metaDataUrl,institutionName,institutionDesc,state,city,country,address,zip,email,firstName,lastName,phone,positionName,geographicExtentCoords,geographicExtentDesc,taxonomicExtent,taxonomicExtentDesc,temporal
Berkeley Sensor Database,"The Sensor Database includes millions of measurements from hundreds of sensor devices located in University of California Natural Reserve System. These sensors record temperature, precipitation, wind speed and direction, solar radiation, barometric pressure, and relative humidity at high resolution increments.",http://sensor.berkeley.edu/,n/a because no IPT,University of California's Natural Reserve System,"University of California's Natural Reserve System (UCNRS) is a network of protected natural areas throughout California. Its 39 sites include more than 756,000 acres, making it the largest university-administered reserve system in the world. Most major state ecosystems are represented, from coastal tide pools to inland deserts, and lush wetlands to Sierra Nevada forests. The reserves also serve as a gateway to more than a million acres of public lands. Founded in 1965 to provide undisturbed environments for research, education, and public service, the Natural Reserve System contributes to the understanding and wise stewardship of the earth.

http://nrs.ucop.edu/#ixzz3Smi4LQJv",CA,Oakland,USA,"1111 Franklin Street, 6th Floor",94607,collin@berkeley.edu,Collin,Bode,(510) 465-2278,Eel River CZO Data Manager,West Bound: -124.26 | East Bound: -114.28 | North Bound: 42.21 | South Bound: 32.5,California,,,"Earliest measurement October 2, 2007. Currently all sensors update every 15 minutes."
CalPhotos,"CalPhotos is a collection of photos of plants, animals, fossils, people, and landscapes from around the world. A variety of organizations and individuals have contributed photographs to CalPhotos. Please be aware that these various contributors maintain copyright and follow the usage guidelines provided with each image.",http://calphotos.berkeley.edu/,n/a because no IPT,"Berkeley Natural History Museums, University of California Berkeley","The Berkeley Natural History Museum (BNHM) is a consortium of 7 museums within University of California Berkeley. These are the Museum of Vertebrate Zoology (MVZ), Essig Museum of Entomology, Phoebe Hearst Museum of Anthropology, UC Museum of Paleontology, University and Jepson Herbaria, UC Botanical Garden and the Human Evolution Research Center (HERC). The BNHM have over 12 million specimens and represent the most complete holdings of living and extinct California flora and fauna. http://bnhm.berkeley.edu/",CA,Berkeley,USA,3101 Valley Life Sciences Building,94720,joyceg@berkeley.edu,Joyce,Gross,(541) 312-0689,Programmer,West Bound: -180 | East Bound: 180 | North Bound: 90 | South Bound: -90,Global,Eukarya and Bacteria,"Plants, animals and fungi, bacteria and slime molds.","June 6, 1900 - current"
UC NRS Field Station Checklist,"Species checklists from University of California Natural Reserve System protected areas. Lists include plants, fungi, and animals.",http://globalchange.berkeley.edu/,n/a because no IPT,"Berkeley Initiative in Global Change Biology, University of California Berkeley",Berkeley Initiative in Global Change Biology (BiGCB) uses state-of-the-art tools and technologies to mobilize historic and modern biological data to understand how organisms and ecological systems have responded to past global change events. This will improve our forecasting of biological system response to future global change. http://globalchange.berkeley.edu/about,CA,Berkeley,USA,3101 Valley Life Sciences Building,94720,ecoengine@berkeley.edu,Michelle,Koo,(510) 642-3567,Principal Investigator,West Bound: -124.26 | East Bound: -114.28 | North Bound: 42.21 | South Bound: 32.5,California,"Plantae, Animalia and Fungi","Plants, animals and fungi.",1900 - current
Wieslander Vegetation Type Mapping Project,"In the 1920s and 1930s Albert Everett Wieslander and others explored much of California's wilderness sampling vegetation, taking photographs, collecting plant specimens, and drawing detailed maps of what they found. These data represent a snapshot of California's vegetation in the early 20th century, and are a valuable resource for comparative and conservation ecology.",http://vtm.berkeley.edu/#/home,n/a because no IPT,"Department of Environmental Science Policy and Management, University of California Berkeley","University of California Berkeley's Department of Environmental Science Policy and Management (ESPM) is a multidisciplinary program that recognizes the urgency of the challenges, and the enormous opportunities that may lead to transformative change. We have award-winning faculty in climate science, biodiversity, environmental policy, land use, and community outreach – all driven by a collective interest in our environmental future. http://ourenvironment.berkeley.edu/welcome-our-environment/",CA,Berkeley,USA,130 Mulford Hall #3114,94720,maggi@berkeley.edu,Maggi,Kelly,(510) 643-7430,Professor,West Bound: -124.26 | East Bound: -114.28 | North Bound: 42.21 | South Bound: 32.5,California,Plantae,Vegetation,1920-1940